{
  "$schema": "foresight/archetype/v2",
  "_readme": {
    "what_this_is": "Archetype MANIFEST for a multi-tenant SaaS / subscription app. Composes from the shared library (library/checkpoints/). Resolve with `node library/resolve.mjs archetype.saas.json`.",
    "reuse": "15 of 18 checkpoints are shared with other archetypes (all of payment.*, auth.*, data.money_precision, security.abuse_controls, and the design.* set). Only 3 are SaaS-specific (saas.tenancy.isolation, saas.subscription.entitlement_integrity, saas.subscription.lifecycle). This is the library paying off: archetype #2 mostly reuses.",
    "ids_are_contracts": "Shared concerns are domain-neutral; SaaS-specific ones carry the saas. prefix. Versioned, never silently renamed.",
    "how_scoring_works": "Levels 3/6/9. 3 = present but crude/risky. 6 = solid, shippable. 9 = great. TRUST THE GAP, NOT THE NUMBER. Goal: 9 on critical, 6+ elsewhere."
  },

  "archetype": "saas",
  "version": "1.0.0",
  "applies_when": "A multi-tenant subscription app: user accounts, tenant/org separation, and recurring billing.",
  "goal_definition": {
    "shippable": "all severity:critical at level >= 6",
    "great": "all severity:critical at 9, all others >= 6",
    "honest_ceiling": "design checkpoints tagged taste_limited verify to ~level 7 mechanically; reaching 9 requires human design review the rubric cannot replace."
  },

  "checkpoints": [
    { "ref": "saas.tenancy.isolation",                    "severity": "critical" },
    { "ref": "saas.subscription.entitlement_integrity",   "severity": "critical" },
    { "ref": "auth.access_control",                        "severity": "critical" },
    { "ref": "payment.idempotency",                        "severity": "critical" },
    { "ref": "payment.state_integrity",                    "severity": "critical" },
    { "ref": "payment.card_data_handling",                 "severity": "critical" },
    { "ref": "payment.webhook_authenticity",               "severity": "critical" },
    { "ref": "auth.session_security",                      "severity": "high" },
    { "ref": "saas.subscription.lifecycle",                "severity": "high" },
    { "ref": "payment.refund_integrity",                   "severity": "high" },
    { "ref": "data.money_precision",                       "severity": "high" },
    { "ref": "security.abuse_controls",                    "severity": "high" },
    { "ref": "design.type_scale",                          "severity": "high" },
    { "ref": "design.contrast_a11y",                       "severity": "high" },
    { "ref": "design.visual_hierarchy",                    "severity": "high" },
    { "ref": "design.system_consistency",                  "severity": "high" },
    { "ref": "design.spacing_system",                      "severity": "medium" },
    { "ref": "design.responsive",                          "severity": "medium" }
  ]
}
